{
  "schema_version": "zentinel.ai.explain.response.v1",
  "classification": "boundary_missing",
  "confidence": "medium",
  "summary": "Mutant m_01hr7p6h0v2fj3drdzt9k2a0xe in src/range.zig (comparison_boundary) is survived; the stub flags a boundary gap.",
  "evidence_refs": [
    {
      "kind": "mutant_diff",
      "ref": "comparison_boundary"
    }
  ],
  "next_action": "Add a test that exercises the boundary case in src/range.zig."
}